name,family,genus,species,authors,citationType,rank,reference,publication,publicationYear,referenceCollation,publicationId,typeLocations,collectorTeam,collectionNumber,collectionDate1,distribution,locality,id,publicationYearNote,remarks,url,source
Diospyros amazonica,Ebenaceae,Diospyros,amazonica,E.H.L.Krause,tax_nov,spec.,Verh. Bot. Vereins Prov. Brandenburg 48: 193. 1907 ,Verh. Bot. Vereins Prov. Brandenburg,1907,48: 193,823-2,NA,NA,NA,NA,Brazil (Southern America),NA,81169-2,NA,NA,www.ipni.org/n/81169-2,IPNI
Diospyros minensis,Ebenaceae,Diospyros,minensis,Glaz.,tax_nov,spec.,Bull. Soc. Bot. France 57(Mém. 3e): 443. 1910 ,Bull. Soc. Bot. France,1910,57(Mém. 3e): 443,578-2,NA,NA,NA,NA,Brazil (Southern America),NA,81221-2,NA,NA,www.ipni.org/n/81221-2,IPNI
Diospyros miroma,Ebenaceae,Diospyros,miroma,B.Walln.,tax_nov,spec.,"Ann. Naturhist. Mus. Wien, B 123: 337. 2021 [Feb 2021] ","Ann. Naturhist. Mus. Wien, B",2021,123: 337,406-2,holotype W;isotype CEPEC;isotype NY,"A.M. Amorim,  S.C. Sant'Ana, J.G. Jardim &amp; E.B. dos Santos",1598,22 Mar 1994,"Bahia (Brazil Northeast, Brazil, Southern America)","Mun. de Una, Reserva Biológica do Mico-Leão (IBAMA), entrada  no km 46 da rod. BA-001 Ilhéus/Una, Fazenda Maruim e Dois de Julho, ao Fundo da  Reserva",77216573-1,Feb 2021,'The plant name has been coined arbitrarily.',www.ipni.org/n/77216573-1,IPNI
Diospyros sprucei,Ebenaceae,Diospyros,sprucei,Hiern,NA,Species,Trans. Cambridge Philos. Soc. 12: 210 (1873),NA,1873,NA,NA,NA,NA,NA,NA,NA,NA,323039-1,NA,NA,https://powo.science.kew.org/taxon/323039-1,POWO
Diospyros lissocarpoides,Ebenaceae,Diospyros,lissocarpoides,Sandwith,NA,Species,Bull. Misc. Inform. Kew 1931: 483 (1931),NA,1931,NA,NA,NA,NA,NA,NA,NA,NA,81211-2,NA,NA,https://powo.science.kew.org/taxon/81211-2,POWO
Diospyros apeibocarpos,Ebenaceae,Diospyros,apeibocarpos,Raddi,NA,Species,Mem. Reale Accad. Sci. Modena 18(Fis.): 391 (1820),NA,1820,NA,NA,NA,NA,NA,NA,NA,NA,322083-1,NA,NA,https://powo.science.kew.org/taxon/322083-1,POWO
