name,family,genus,species,authors,citationType,rank,reference,publication,publicationYear,referenceCollation,publicationId,typeLocations,collectorTeam,collectionNumber,collectionDate1,distribution,locality,id,publicationYearNote,remarks,url,source
Amyris brasiliensis,Rutaceae,Amyris,brasiliensis,Spreng.,tax_nov,spec.,"Syst. Veg., ed. 16 [Sprengel] 2: 217. 1825 [Jan-May 1825] ","Syst. Veg., ed. 16 [Sprengel]",1825,2: 217,14620-2,holotype P?,F. Sellow,s.n.,NA,Brazil (Southern America),NA,12150-2,Jan-May 1825,NA,www.ipni.org/n/12150-2,IPNI
Amyris macrocarpa,Rutaceae,Amyris,macrocarpa,Gereau,tax_nov,spec.,"Candollea 46: 231, fig. 2. 1991 ",Candollea,1991,"46: 231, fig. 2",885-2,holotype MO;isotype UC,B.Berlin,1776,NA,"Amazonas (Brazil, Southern America)",NA,272091-2,NA,NA,www.ipni.org/n/272091-2,IPNI
Moniera bahiensis,Rutaceae,Moniera,bahiensis,Engl.,tax_nov,spec.,"Fl. Bras. (Martius) 12(2): 129, t. 127, fig. 2. 1874 [1 Sep 1874] (as Monnieria bahiensis)",Fl. Bras. (Martius),1874,"12(2): 129, t. 127, fig. 2",629-2,NA,NA,NA,NA,"Bahia (Brazil, Southern America)",Habitat in silvis umbrosis ad rivulos,163459-2,1 Sep 1874,NA,www.ipni.org/n/163459-2,IPNI
Pohlana langsdorffii,Rutaceae,Pohlana,langsdorffii,Nees & Mart.,tax_nov,spec.,Nova Acta Phys.-Med. Acad. Caes. Leop.-Carol. Nat. Cur. 12(1): 17. 1824 ,Nova Acta Phys.-Med. Acad. Caes. Leop.-Carol. Nat. Cur.,1824,12(1): 17,1025-2,NA,NA,NA,NA,Brazil (Southern America),NA,329420-2,NA,NA,www.ipni.org/n/329420-2,IPNI
Rauia prancii,Rutaceae,Rauia,prancii,W.A.Rodrigues & M.F.Silva,tax_nov,spec.,"Acta Amazonica 1(1): 21, fig. 1. 1971 Acta Amazonica 1(2): 34.  1971",Acta Amazonica,1971,"1(1): 21, fig. 1",1144-2,holotype INPA,Prance et al,8944,NA,"Rondonia (Terr.) (Brazil, Southern America)",NA,217894-2,NA,NA,www.ipni.org/n/217894-2,IPNI
Raveniopsis necopinnata,Rutaceae,Raveniopsis,necopinnata,Kallunki,tax_nov,spec.,"Bol. Mus. Paraense Emilio Goeldi, N.S., Bot. 7: 302, figs. 1, 2a. 1991 ","Bol. Mus. Paraense Emilio Goeldi, N.S., Bot.",1991,"7: 302, figs. 1, 2a",1871-2,holotype MG;isotype GH;isotype MO;isotype NY;isotype US,"J.U.M.dos Santos, F.Ramos, C.D.A.Mota",295,NA,"Rondonia (Terr.) (Brazil, Southern America)",NA,301693-2,NA,NA,www.ipni.org/n/301693-2,IPNI
